<?xml version="1.0" encoding="utf-8"?>
<Metadata ModelName="Northwind" Version="1.0" 
          xmlns="http://iris.temenos.com/metadata.xsd"
          xmlns:xsi="http://www.w3.org/2001/XMLSchema-instance"
          xsi:schemaLocation="http://iris.temenos.com metadata.xsd">
	<Entity Name="Suppliers">
		<Property Name="HomePage" />
		<Property Name="ContactName" />
		<Property Name="Phone" />
		<Property Name="ContactTitle" />
		<Property Name="Country" />
		<Property Name="Fax" />
		<Property Name="Address" />
		<Property Name="CompanyName">
			<Term Name="TERM_MANDATORY">true</Term>
		</Property>
		<Property Name="City" />
		<Property Name="PostalCode" />
		<Property Name="SupplierID">
			<Term Name="TERM_MANDATORY">true</Term>
			<Term Name="TERM_VALUE_TYPE">INTEGER_NUMBER</Term>
			<Term Name="TERM_ID_FIELD">true</Term>
		</Property>
		<Property Name="Region" />
	</Entity>
	<Entity Name="Orders">
		<Property Name="EmployeeID">
			<Term Name="TERM_VALUE_TYPE">INTEGER_NUMBER</Term>
		</Property>
		<Property Name="ShipName" />
		<Property Name="CustomerID" />
		<Property Name="ShipVia">
			<Term Name="TERM_VALUE_TYPE">INTEGER_NUMBER</Term>
		</Property>
		<Property Name="OrderDate">
			<Term Name="TERM_VALUE_TYPE">TIMESTAMP</Term>
		</Property>
		<Property Name="ShipCity" />
		<Property Name="RequiredDate">
			<Term Name="TERM_VALUE_TYPE">TIMESTAMP</Term>
		</Property>
		<Property Name="OrderID">
			<Term Name="TERM_MANDATORY">true</Term>
			<Term Name="TERM_VALUE_TYPE">INTEGER_NUMBER</Term>
			<Term Name="TERM_ID_FIELD">true</Term>
		</Property>
		<Property Name="ShipCountry" />
		<Property Name="ShipRegion" />
		<Property Name="ShipPostalCode" />
		<Property Name="Freight">
			<Term Name="TERM_VALUE_TYPE">NUMBER</Term>
		</Property>
		<Property Name="ShipAddress" />
		<Property Name="ShippedDate">
			<Term Name="TERM_VALUE_TYPE">TIMESTAMP</Term>
		</Property>
	</Entity>
	<Entity Name="Order_Details">
		<Property Name="OrderID">
			<Term Name="TERM_MANDATORY">true</Term>
			<Term Name="TERM_VALUE_TYPE">INTEGER_NUMBER</Term>
			<Term Name="TERM_ID_FIELD">true</Term>
		</Property>
		<Property Name="ProductID">
			<Term Name="TERM_MANDATORY">true</Term>
			<Term Name="TERM_VALUE_TYPE">INTEGER_NUMBER</Term>
			<Term Name="TERM_ID_FIELD">true</Term>
		</Property>
		<Property Name="Discount">
			<Term Name="TERM_MANDATORY">true</Term>
			<Term Name="TERM_VALUE_TYPE">NUMBER</Term>
		</Property>
		<Property Name="UnitPrice">
			<Term Name="TERM_MANDATORY">true</Term>
			<Term Name="TERM_VALUE_TYPE">NUMBER</Term>
		</Property>
		<Property Name="Quantity">
			<Term Name="TERM_MANDATORY">true</Term>
			<Term Name="TERM_VALUE_TYPE">INTEGER_NUMBER</Term>
		</Property>
	</Entity>
	<Entity Name="Customers">
		<Property Name="ContactTitle" />
		<Property Name="ContactName" />
		<Property Name="City" />
		<Property Name="Fax" />
		<Property Name="CompanyName">
			<Term Name="TERM_MANDATORY">true</Term>
		</Property>
		<Property Name="Address" />
		<Property Name="CustomerID">
			<Term Name="TERM_MANDATORY">true</Term>
			<Term Name="TERM_ID_FIELD">true</Term>
		</Property>
		<Property Name="Region" />
		<Property Name="Country" />
		<Property Name="Phone" />
		<Property Name="PostalCode" />
	</Entity>
	<Entity Name="Categories">
		<Property Name="CategoryID">
			<Term Name="TERM_MANDATORY">true</Term>
			<Term Name="TERM_VALUE_TYPE">INTEGER_NUMBER</Term>
			<Term Name="TERM_ID_FIELD">true</Term>
		</Property>
		<Property Name="CategoryName">
			<Term Name="TERM_MANDATORY">true</Term>
		</Property>
		<Property Name="Description" />
		<Property Name="Picture" />
	</Entity>
	<Entity Name="Employees">
		<Property Name="Country" />
		<Property Name="PostalCode" />
		<Property Name="Region" />
		<Property Name="ReportsTo">
			<Term Name="TERM_VALUE_TYPE">INTEGER_NUMBER</Term>
		</Property>
		<Property Name="LastName">
			<Term Name="TERM_MANDATORY">true</Term>
		</Property>
		<Property Name="Notes" />
		<Property Name="HireDate">
			<Term Name="TERM_VALUE_TYPE">TIMESTAMP</Term>
		</Property>
		<Property Name="PhotoPath" />
		<Property Name="EmployeeID">
			<Term Name="TERM_MANDATORY">true</Term>
			<Term Name="TERM_VALUE_TYPE">INTEGER_NUMBER</Term>
			<Term Name="TERM_ID_FIELD">true</Term>
		</Property>
		<Property Name="Photo" />
		<Property Name="FirstName">
			<Term Name="TERM_MANDATORY">true</Term>
		</Property>
		<Property Name="HomePhone" />
		<Property Name="City" />
		<Property Name="Address" />
		<Property Name="TitleOfCourtesy" />
		<Property Name="BirthDate">
			<Term Name="TERM_VALUE_TYPE">TIMESTAMP</Term>
		</Property>
		<Property Name="Extension" />
		<Property Name="Title" />
	</Entity>
	<Entity Name="Products">
		<Property Name="ProductName">
			<Term Name="TERM_MANDATORY">true</Term>
		</Property>
		<Property Name="UnitPrice">
			<Term Name="TERM_VALUE_TYPE">NUMBER</Term>
		</Property>
		<Property Name="QuantityPerUnit" />
		<Property Name="ProductID">
			<Term Name="TERM_MANDATORY">true</Term>
			<Term Name="TERM_VALUE_TYPE">INTEGER_NUMBER</Term>
			<Term Name="TERM_ID_FIELD">true</Term>
		</Property>
		<Property Name="ReorderLevel">
			<Term Name="TERM_VALUE_TYPE">INTEGER_NUMBER</Term>
		</Property>
		<Property Name="CategoryID">
			<Term Name="TERM_VALUE_TYPE">INTEGER_NUMBER</Term>
		</Property>
		<Property Name="SupplierID">
			<Term Name="TERM_VALUE_TYPE">INTEGER_NUMBER</Term>
		</Property>
		<Property Name="Discontinued">
			<Term Name="TERM_MANDATORY">true</Term>
			<Term Name="TERM_VALUE_TYPE">BOOLEAN</Term>
		</Property>
		<Property Name="UnitsInStock">
			<Term Name="TERM_VALUE_TYPE">INTEGER_NUMBER</Term>
		</Property>
		<Property Name="UnitsOnOrder">
			<Term Name="TERM_VALUE_TYPE">INTEGER_NUMBER</Term>
		</Property>
	</Entity>
</Metadata>
