<?xml version="1.0" encoding="UTF-8"?>
<!--
  #%L
  interaction-media-odata-xml
  %%
  Copyright (C) 2012 - 2015 Temenos Holdings N.V.
  %%
  This program is free software: you can redistribute it and/or modify
  it under the terms of the GNU Affero General Public License as published by
  the Free Software Foundation, either version 3 of the License, or
  (at your option) any later version.
  
  This program is distributed in the hope that it will be useful,
  but WITHOUT ANY WARRANTY; without even the implied warranty of
  MERCHANTABILITY or FITNESS FOR A PARTICULAR PURPOSE.  See the
  GNU General Public License for more details.
  
  You should have received a copy of the GNU Affero General Public License
  along with this program.  If not, see <http://www.gnu.org/licenses/>.
  #L%
  -->
		
<Metadata ModelName="CustomerServiceTest" Version="1.0" 
		xmlns="http://iris.temenos.com/metadata.xsd" 
		xmlns:xsi="http://www.w3.org/2001/XMLSchema-instance" 
		xsi:schemaLocation="http://iris.temenos.com metadata.xsd">
	<Entity Name="T24FieldMetadata">
		<Property Name="Id">
			<Term Name="TERM_ID_FIELD">true</Term>
		</Property>
		<Property Name="Entity" />
		<Property Name="Property" />
		<Property Name="Visible" />
		<Property Name="Mandatory" />
		<Property Name="MandatorySelection" />
		<Property Name="ReadOnly" />
		<Property Name="EnrichmentsMvGroup">
			<Term Name="TERM_LIST_TYPE">true</Term>
			<Property Name="valuePosition" />
			<Property Name="subValuePosition" />
			<Property Name="FieldNumber" />
			<Property Name="FieldValue" />
			<Property Name="Enrichment" />
		</Property>
		<Property Name="PossibleValuesMvGroup">
			<Term Name="TERM_LIST_TYPE">true</Term>
			<Property Name="valuePosition" />
			<Property Name="subValuePosition" />
			<Property Name="Value" />
			<Property Name="Description" />
		</Property>
		<Property Name="AAPropertiesMvGroup">
			<Term Name="TERM_LIST_TYPE">true</Term>
			<Property Name="valuePosition" />
			<Property Name="subValuePosition" />
			<Property Name="T24AppVersion" />
			<Property Name="PropertyClassDecription" />
			<Property Name="PropertyDecription" />
			<Property Name="ForwardDateable" />
		</Property>
	</Entity>
</Metadata>
