<?xml version="1.0" encoding="utf-8"?>
<!--
  #%L
  interaction-example-odata-embedded
  %%
  Copyright (C) 2012 - 2014 Temenos Holdings N.V.
  %%
  This program is free software: you can redistribute it and/or modify
  it under the terms of the GNU Affero General Public License as published by
  the Free Software Foundation, either version 3 of the License, or
  (at your option) any later version.
  
  This program is distributed in the hope that it will be useful,
  but WITHOUT ANY WARRANTY; without even the implied warranty of
  MERCHANTABILITY or FITNESS FOR A PARTICULAR PURPOSE.  See the
  GNU General Public License for more details.
  
  You should have received a copy of the GNU Affero General Public License
  along with this program.  If not, see <http://www.gnu.org/licenses/>.
  #L%
  -->

<Metadata ModelName="interaction-odata-embedded" Version="1.0" 
          xmlns="http://iris.temenos.com/metadata.xsd"
          xmlns:xsi="http://www.w3.org/2001/XMLSchema-instance"
          xsi:schemaLocation="http://iris.temenos.com metadata.xsd">
    <Entity Name="ServiceDocument"></Entity>
    <Entity Name="Metadata"></Entity>
	<Entity Name="Airport">
		<Property Name="name">
			<Term Name="TERM_MANDATORY">true</Term>
		</Property>
		<Property Name="code">
			<Term Name="TERM_ID_FIELD">true</Term>
		</Property>
		<Property Name="country">
			<Term Name="TERM_MANDATORY">true</Term>
		</Property>
	</Entity>
	<Entity Name="Flight">
		<Property Name="flightID">
			<Term Name="TERM_VALUE_TYPE">INTEGER_NUMBER</Term>
			<Term Name="TERM_ID_FIELD">true</Term>
		</Property>
		<Property Name="flightScheduleNum">
			<Term Name="TERM_VALUE_TYPE">INTEGER_NUMBER</Term>
		</Property>
		<Property Name="takeoffTime">
			<Term Name="TERM_MANDATORY">true</Term>
			<Term Name="TERM_VALUE_TYPE">TIMESTAMP</Term>
		</Property>
	</Entity>
	<Entity Name="FlightSchedule">
		<Property Name="flightNo">
			<Term Name="TERM_MANDATORY">true</Term>
		</Property>
		<Property Name="arrivalAirportCode">
			<Term Name="TERM_MANDATORY">true</Term>
		</Property>
		<Property Name="arrivalTime">
			<Term Name="TERM_MANDATORY">true</Term>
			<Term Name="TERM_VALUE_TYPE">TIME</Term>
		</Property>
		<Property Name="departureTime">
			<Term Name="TERM_MANDATORY">true</Term>
			<Term Name="TERM_VALUE_TYPE">TIME</Term>
		</Property>
		<Property Name="departureAirportCode">
			<Term Name="TERM_MANDATORY">true</Term>
		</Property>
		<Property Name="flightScheduleID">
			<Term Name="TERM_VALUE_TYPE">INTEGER_NUMBER</Term>
			<Term Name="TERM_ID_FIELD">true</Term>
		</Property>
		<Property Name="firstDeparture">
			<Term Name="TERM_MANDATORY">true</Term>
			<Term Name="TERM_VALUE_TYPE">TIMESTAMP</Term>
		</Property>
		<Property Name="lastDeparture">
			<Term Name="TERM_MANDATORY">true</Term>
			<Term Name="TERM_VALUE_TYPE">TIMESTAMP</Term>
		</Property>
	</Entity>
	<Entity Name="Passenger">
		<Property Name="dateOfBirth">
			<Term Name="TERM_VALUE_TYPE">TIMESTAMP</Term>
		</Property>
		<Property Name="passengerNo">
			<Term Name="TERM_VALUE_TYPE">INTEGER_NUMBER</Term>
			<Term Name="TERM_ID_FIELD">true</Term>
		</Property>
		<Property Name="flightID">
			<Term Name="TERM_VALUE_TYPE">INTEGER_NUMBER</Term>
		</Property>
		<Property Name="name">
			<Term Name="TERM_MANDATORY">true</Term>
		</Property>
	</Entity>
</Metadata>
