<?xml version="1.0" encoding="utf-8"?>
<Metadata ModelName="HateoasBanking" Version="1.0" 
          xmlns="http://iris.temenos.com/metadata.xsd"
          xmlns:xsi="http://www.w3.org/2001/XMLSchema-instance"
          xsi:schemaLocation="http://iris.temenos.com metadata.xsd">
	<Entity Name="Preferences">
		<Property Name="userID">
			<Term Name="TERM_MANDATORY">true</Term>
			<Term Name="TERM_ID_FIELD">true</Term>
		</Property>
		<Property Name="currency">
			<Term Name="TERM_MANDATORY">true</Term>
		</Property>
		<Property Name="language" />
	</Entity>
	<Entity Name="FundsTransfer">
		<Property Name="id">
			<Term Name="TERM_MANDATORY">true</Term>
			<Term Name="TERM_VALUE_TYPE">INTEGER_NUMBER</Term>
			<Term Name="TERM_ID_FIELD">true</Term>
		</Property>
		<Property Name="body" >
			<Term Name="TERM_MANDATORY">true</Term>
		</Property>
	</Entity>
	<Entity Name="Customer">
		<Property Name="name" >
			<Term Name="TERM_ID_FIELD">true</Term>
		</Property>
		<Property Name="address">
			<Property Name="number">
				<Term Name="TERM_VALUE_TYPE">INTEGER_NUMBER</Term>
			</Property>
			<Property Name="postCode" />
		</Property>
		<Property Name="dateOfBirth" >
			<Term Name="TERM_MANDATORY">true</Term>
			<Term Name="TERM_VALUE_TYPE">TIMESTAMP</Term>
		</Property>
	</Entity>
</Metadata>
