<?xml version="1.0" encoding="utf-8"?>
<!--
  #%L
  interaction-odata4j-ext
  %%
  Copyright (C) 2012 - 2013 Temenos Holdings N.V.
  %%
  This program is free software: you can redistribute it and/or modify
  it under the terms of the GNU Affero General Public License as published by
  the Free Software Foundation, either version 3 of the License, or
  (at your option) any later version.
  
  This program is distributed in the hope that it will be useful,
  but WITHOUT ANY WARRANTY; without even the implied warranty of
  MERCHANTABILITY or FITNESS FOR A PARTICULAR PURPOSE.  See the
  GNU General Public License for more details.
  
  You should have received a copy of the GNU Affero General Public License
  along with this program.  If not, see <http://www.gnu.org/licenses/>.
  #L%
  -->

<Metadata ModelName="CustomerServiceTest" Version="1.0" 
          xmlns="http://iris.temenos.com/metadata.xsd"
          xmlns:xsi="http://www.w3.org/2001/XMLSchema-instance"
          xsi:schemaLocation="http://iris.temenos.com metadata.xsd">
	<Entity Name="Customer">
		<Property Name="name" >
			<Term Name="TERM_ID_FIELD">true</Term>
		</Property>
		<Property Name="address">
			<Term Name="TERM_COMPLEX_TYPE">true</Term>
		</Property>
		<Property Name="number">
			<Term Name="TERM_COMPLEX_GROUP">address</Term>
			<Term Name="TERM_VALUE_TYPE">INTEGER_NUMBER</Term>
		</Property>
		<Property Name="street">
			<Term Name="TERM_COMPLEX_GROUP">address</Term>
			<Term Name="TERM_COMPLEX_TYPE">true</Term>
		</Property>
		<Property Name="streetType">
			<Term Name="TERM_COMPLEX_GROUP">street</Term>
		</Property>
		<Property Name="town" >
			<Term Name="TERM_COMPLEX_GROUP">address</Term>
		</Property>
		<Property Name="postCode" >
			<Term Name="TERM_COMPLEX_GROUP">address</Term>
		</Property>
		<Property Name="dateOfBirth" >
			<Term Name="TERM_MANDATORY">true</Term>
			<Term Name="TERM_VALUE_TYPE">TIMESTAMP</Term>
		</Property>
		<Property Name="sector" />
		<Property Name="industry" />
		<Property Name="loyal" >
			<Term Name="TERM_VALUE_TYPE">BOOLEAN</Term>
		</Property>
		<Property Name="loyalty_rating" >
			<Term Name="TERM_VALUE_TYPE">NUMBER</Term>
		</Property>
	</Entity>
	<Entity Name="CustomerWithTermList">
		<Property Name="name" >
			<Term Name="TERM_ID_FIELD">true</Term>
		</Property>
		<Property Name="address">
			<Term Name="TERM_COMPLEX_TYPE">true</Term>
			<Term Name="TERM_LIST_TYPE">true</Term>
		</Property>
		<Property Name="number">
			<Term Name="TERM_COMPLEX_GROUP">address</Term>
			<Term Name="TERM_VALUE_TYPE">INTEGER_NUMBER</Term>
		</Property>
		<Property Name="street">
			<Term Name="TERM_COMPLEX_GROUP">address</Term>
			<Term Name="TERM_COMPLEX_TYPE">true</Term>
			<Term Name="TERM_LIST_TYPE">true</Term>
		</Property>
		<Property Name="streetType" >
			<Term Name="TERM_COMPLEX_GROUP">street</Term>
		</Property>
		<Property Name="streetName" >
			<Term Name="TERM_COMPLEX_GROUP">street</Term>
		</Property>
		<Property Name="town" >
			<Term Name="TERM_COMPLEX_GROUP">address</Term>
		</Property>
		<Property Name="postCode" >
			<Term Name="TERM_COMPLEX_GROUP">address</Term>
		</Property>
		<Property Name="dateOfBirth" >
			<Term Name="TERM_MANDATORY">true</Term>
			<Term Name="TERM_VALUE_TYPE">TIMESTAMP</Term>
		</Property>
		<Property Name="sector" />
		<Property Name="industry" />
		<Property Name="loyal" >
			<Term Name="TERM_VALUE_TYPE">BOOLEAN</Term>
		</Property>
		<Property Name="loyalty_rating" >
			<Term Name="TERM_VALUE_TYPE">NUMBER</Term>
		</Property>
	</Entity>
</Metadata>
