<?xml version="1.0" encoding="UTF-8"?>
<!--
  #%L
  interaction-media-odata-xml
  %%
  Copyright (C) 2012 - 2014 Temenos Holdings N.V.
  %%
  This program is free software: you can redistribute it and/or modify
  it under the terms of the GNU Affero General Public License as published by
  the Free Software Foundation, either version 3 of the License, or
  (at your option) any later version.
  
  This program is distributed in the hope that it will be useful,
  but WITHOUT ANY WARRANTY; without even the implied warranty of
  MERCHANTABILITY or FITNESS FOR A PARTICULAR PURPOSE.  See the
  GNU General Public License for more details.
  
  You should have received a copy of the GNU Affero General Public License
  along with this program.  If not, see <http://www.gnu.org/licenses/>.
  #L%
  -->
		
<Metadata ModelName="hothouse-models" Version="1.0" 
		xmlns="http://iris.temenos.com/metadata.xsd" 
		xmlns:xsi="http://www.w3.org/2001/XMLSchema-instance" 
		xsi:schemaLocation="http://iris.temenos.com metadata.xsd">
	<Entity Name="FtCommissionType">
		<Property Name="CommissionType">
			<Term Name="TERM_ID_FIELD">true</Term>
			<Term Name="TERM_MANDATORY">true</Term>
			<Term Name="TERM_SEMANTIC_TYPE">A</Term>
		</Property>
		<Property Name="DescriptionMvGroup">
			<Term Name="TERM_LIST_TYPE">true</Term>
			<Term Name="TERM_LANG_TYPE">true</Term>
			<Property Name="LanguageCode" />
			<Property Name="Description">
				<Term Name="TERM_MANDATORY">true</Term>
				<Term Name="TERM_SEMANTIC_TYPE">A</Term>
			</Property>
		</Property>
		<Property Name="ShortDescrMvGroup">
			<Term Name="TERM_LIST_TYPE">true</Term>
			<Term Name="TERM_LANG_TYPE">true</Term>
			<Property Name="LanguageCode" />
			<Property Name="ShortDescr">
				<Term Name="TERM_MANDATORY">true</Term>
				<Term Name="TERM_SEMANTIC_TYPE">A</Term>
			</Property>
		</Property>
		<Property Name="CcyConvDependent" />
		<Property Name="CategoryAccount">
			<Term Name="TERM_MANDATORY">true</Term>
			<Term Name="TERM_SEMANTIC_TYPE">A</Term>
		</Property>
		<Property Name="TxnCodeCr">
			<Term Name="TERM_MANDATORY">true</Term>
		</Property>
		<Property Name="TxnCodeDr">
			<Term Name="TERM_MANDATORY">true</Term>
		</Property>
		<Property Name="TaxCode">
			<Term Name="TERM_SEMANTIC_TYPE">A</Term>
		</Property>
		<Property Name="CalculationBasis" />
		<Property Name="CurrencyMvGroup">
			<Term Name="TERM_LIST_TYPE">true</Term>
			<Property Name="Currency">
				<Term Name="TERM_SEMANTIC_TYPE">CCY</Term>
			</Property>
			<Property Name="FlatAmt">
				<Term Name="TERM_SEMANTIC_TYPE">AMT</Term>
			</Property>
			<Property Name="CalcTypeSvGroup">
				<Term Name="TERM_LIST_TYPE">true</Term>
				<Property Name="CalcType" />
				<Property Name="Percentage">
					<Term Name="TERM_SEMANTIC_TYPE">R</Term>
				</Property>
				<Property Name="UnitCharge">
					<Term Name="TERM_SEMANTIC_TYPE">AMT</Term>
				</Property>
				<Property Name="UptoAmt">
					<Term Name="TERM_SEMANTIC_TYPE">AMT</Term>
				</Property>
				<Property Name="MinimumAmt">
					<Term Name="TERM_SEMANTIC_TYPE">AMT</Term>
				</Property>
				<Property Name="MaximumAmt">
					<Term Name="TERM_SEMANTIC_TYPE">AMT</Term>
				</Property>
			</Property>
			<Property Name="RoundType" />
			<Property Name="RoundUnit">
				<Term Name="TERM_SEMANTIC_TYPE">R</Term>
			</Property>
			<Property Name="OverallMinPct">
				<Term Name="TERM_SEMANTIC_TYPE">R</Term>
			</Property>
			<Property Name="OverallMaxPct">
				<Term Name="TERM_SEMANTIC_TYPE">R</Term>
			</Property>
			<Property Name="OverallMinAmt">
				<Term Name="TERM_SEMANTIC_TYPE">AMT</Term>
			</Property>
			<Property Name="OverallMaxAmt">
				<Term Name="TERM_SEMANTIC_TYPE">AMT</Term>
			</Property>
			<Property Name="AccrualMinAmt">
				<Term Name="TERM_SEMANTIC_TYPE">AMT</Term>
			</Property>
		</Property>
		<Property Name="MthlyAmortisation" />
		<Property Name="AmortisnPeriod">
			<Term Name="TERM_SEMANTIC_TYPE">A</Term>
		</Property>
		<Property Name="ChargePeriod" />
		<Property Name="MinimumPeriod" />
		<Property Name="ResidencyMvGroup">
			<Term Name="TERM_LIST_TYPE">true</Term>
			<Property Name="Residency">
				<Term Name="TERM_SEMANTIC_TYPE">A</Term>
			</Property>
		</Property>
		<Property Name="NonResidencyMvGroup">
			<Term Name="TERM_LIST_TYPE">true</Term>
			<Property Name="NonResidency">
				<Term Name="TERM_SEMANTIC_TYPE">A</Term>
			</Property>
		</Property>
		<Property Name="LinkMvGroup">
			<Term Name="TERM_LIST_TYPE">true</Term>
			<Property Name="Link">
				<Term Name="TERM_SEMANTIC_TYPE">A</Term>
			</Property>
		</Property>
		<Property Name="NextDateMvGroup">
			<Term Name="TERM_LIST_TYPE">true</Term>
			<Property Name="NextDate" />
		</Property>
		<Property Name="AccrualFqu" />
		<Property Name="AccrueAmort" />
		<Property Name="SwiftNarr">
			<Term Name="TERM_SEMANTIC_TYPE">S</Term>
		</Property>
		<Property Name="DefaultCcy">
			<Term Name="TERM_SEMANTIC_TYPE">CCY</Term>
		</Property>
		<Property Name="ChargeRoutine">
			<Term Name="TERM_SEMANTIC_TYPE">A</Term>
		</Property>
		<Property Name="ExcludeFromEir" />
		<Property Name="Reserved2" />
		<Property Name="Reserved1" />
		<Property Name="OverrideMvGroup">
			<Term Name="TERM_LIST_TYPE">true</Term>
			<Property Name="Override">
				<Term Name="TERM_SEMANTIC_TYPE">A</Term>
			</Property>
		</Property>
		<Property Name="RecordStatus">
			<Term Name="TERM_SEMANTIC_TYPE">STAT</Term>
		</Property>
		<Property Name="CurrNo" />
		<Property Name="InputterMvGroup">
			<Term Name="TERM_LIST_TYPE">true</Term>
			<Property Name="Inputter">
				<Term Name="TERM_SEMANTIC_TYPE">A</Term>
			</Property>
		</Property>
		<Property Name="DateTimeMvGroup">
			<Term Name="TERM_LIST_TYPE">true</Term>
			<Property Name="DateTime">
				<Term Name="TERM_SEMANTIC_TYPE">RELTIME</Term>
			</Property>
		</Property>
		<Property Name="Authoriser">
			<Term Name="TERM_SEMANTIC_TYPE">A</Term>
		</Property>
		<Property Name="CoCode">
			<Term Name="TERM_SEMANTIC_TYPE">A</Term>
		</Property>
		<Property Name="DeptCode" />
		<Property Name="AuditorCode">
			<Term Name="TERM_SEMANTIC_TYPE">A</Term>
		</Property>
		<Property Name="AuditDateTime">
			<Term Name="TERM_SEMANTIC_TYPE">RELTIME</Term>
		</Property>
	</Entity>
</Metadata>
