<?xml version="1.0" encoding="utf-8"?>
<!--
  #%L
  interaction-sdk
  %%
  Copyright (C) 2012 - 2013 Temenos Holdings N.V.
  %%
  This program is free software: you can redistribute it and/or modify
  it under the terms of the GNU Affero General Public License as published by
  the Free Software Foundation, either version 3 of the License, or
  (at your option) any later version.
  
  This program is distributed in the hope that it will be useful,
  but WITHOUT ANY WARRANTY; without even the implied warranty of
  MERCHANTABILITY or FITNESS FOR A PARTICULAR PURPOSE.  See the
  GNU General Public License for more details.
  
  You should have received a copy of the GNU Affero General Public License
  along with this program.  If not, see <http://www.gnu.org/licenses/>.
  #L%
  -->

<Metadata ModelName="Banking" Version="1.0" 
          xmlns="http://iris.temenos.com/metadata.xsd"
          xmlns:xsi="http://www.w3.org/2001/XMLSchema-instance"
          xsi:schemaLocation="http://iris.temenos.com metadata.xsd">
	<Entity Name="Sector">
		<Property Name="Authoriser" />
		<Property Name="DeptCode" />
		<Property Name="Description">
			<Term Name="TERM_COMPLEX_GROUP">DescriptionMvGroup</Term>
		</Property>
		<Property Name="RecordStatus" />
		<Property Name="RiskExpoType" />
		<Property Name="AuditDateTime">
			<Term Name="TERM_VALUE_TYPE">DATE</Term>
		</Property>
		<Property Name="ShortNameMvGroup">
			<Term Name="TERM_COMPLEX_TYPE">true</Term>
		</Property>
		<Property Name="Reserved1" />
		<Property Name="Reserved3" />
		<Property Name="SectorCode">
			<Term Name="TERM_ID_FIELD">true</Term>
		</Property>
		<Property Name="Reserved2" />
		<Property Name="CoCode" />
		<Property Name="Reserved4" />
		<Property Name="CurrNo" />
		<Property Name="DateTime">
			<Term Name="TERM_COMPLEX_GROUP">DateTimeMvGroup</Term>
		</Property>
		<Property Name="Inputter">
			<Term Name="TERM_COMPLEX_GROUP">InputterMvGroup</Term>
		</Property>
		<Property Name="ShortName">
			<Term Name="TERM_COMPLEX_GROUP">ShortNameMvGroup</Term>
		</Property>
		<Property Name="InputterMvGroup">
			<Term Name="TERM_COMPLEX_TYPE">true</Term>
		</Property>
		<Property Name="DateTimeMvGroup">
			<Term Name="TERM_COMPLEX_TYPE">true</Term>
		</Property>
		<Property Name="DescriptionMvGroup">
			<Term Name="TERM_COMPLEX_TYPE">true</Term>
		</Property>
		<Property Name="AuditorCode" />
	</Entity>
</Metadata>
