<?xml version="1.0" encoding="utf-8"?>
<Metadata ModelName="FlightResponder" Version="1.0" 
          xmlns="http://iris.temenos.com/metadata.xsd"
          xmlns:xsi="http://www.w3.org/2001/XMLSchema-instance"
          xsi:schemaLocation="http://iris.temenos.com metadata.xsd">
    <Entity Name="ServiceDocument"></Entity>
    <Entity Name="Metadata"></Entity>
	<Entity Name="Exception">
		<Property Name="code" >
			<Term Name="TERM_MANDATORY">true</Term>
		</Property>
		<Property Name="errorMessage" />
	</Entity>
	<Entity Name="FlightSchedule">
		<Property Name="flightNo" />
		<Property Name="arrivalAirportCode" />
		<Property Name="arrivalTime">
			<Term Name="TERM_VALUE_TYPE">TIME</Term>
		</Property>
		<Property Name="departureTime">
			<Term Name="TERM_VALUE_TYPE">TIME</Term>
		</Property>
		<Property Name="departureAirportCode" />
		<Property Name="flightScheduleID">
			<Term Name="TERM_MANDATORY">true</Term>
			<Term Name="TERM_VALUE_TYPE">INTEGER_NUMBER</Term>
			<Term Name="TERM_ID_FIELD">true</Term>
		</Property>
		<Property Name="firstDeparture">
			<Term Name="TERM_VALUE_TYPE">TIMESTAMP</Term>
		</Property>
		<Property Name="lastDeparture">
			<Term Name="TERM_VALUE_TYPE">TIMESTAMP</Term>
		</Property>
	</Entity>
	<Entity Name="Airport">
		<Property Name="name" />
		<Property Name="code">
			<Term Name="TERM_MANDATORY">true</Term>
			<Term Name="TERM_ID_FIELD">true</Term>
		</Property>
		<Property Name="country" />
	</Entity>
	<Entity Name="Flight">
		<Property Name="flightID">
			<Term Name="TERM_MANDATORY">true</Term>
			<Term Name="TERM_VALUE_TYPE">INTEGER_NUMBER</Term>
			<Term Name="TERM_ID_FIELD">true</Term>
		</Property>
		<Property Name="flightScheduleNum">
			<Term Name="TERM_MANDATORY">true</Term>
			<Term Name="TERM_VALUE_TYPE">INTEGER_NUMBER</Term>
		</Property>
		<Property Name="takeoffTime">
			<Term Name="TERM_VALUE_TYPE">TIMESTAMP</Term>
		</Property>
	</Entity>
	<Entity Name="Passenger">
		<Property Name="passengerNo">
			<Term Name="TERM_MANDATORY">true</Term>
			<Term Name="TERM_VALUE_TYPE">INTEGER_NUMBER</Term>
			<Term Name="TERM_ID_FIELD">true</Term>
		</Property>
		<Property Name="flightID">
			<Term Name="TERM_MANDATORY">true</Term>
			<Term Name="TERM_VALUE_TYPE">INTEGER_NUMBER</Term>
		</Property>
		<Property Name="name" />
		<Property Name="dateOfBirth" >
			<Term Name="TERM_MANDATORY">true</Term>
			<Term Name="TERM_VALUE_TYPE">TIMESTAMP</Term>
		</Property>
		<!-- Property Name="address">
			<Term Name="TERM_COMPLEX_TYPE">true</Term>
		</Property>
		<Property Name="number">
			<Term Name="TERM_COMPLEX_GROUP">address</Term>
			<Term Name="TERM_VALUE_TYPE">INTEGER_NUMBER</Term>
		</Property>
		<Property Name="street">
			<Term Name="TERM_COMPLEX_GROUP">address</Term>
			<Term Name="TERM_COMPLEX_TYPE">true</Term>
		</Property>
		<Property Name="streetType" >
			<Term Name="TERM_COMPLEX_GROUP">street</Term>
		</Property>
		<Property Name="town" >
			<Term Name="TERM_COMPLEX_GROUP">address</Term>
		</Property>
		<Property Name="postCode" >
			<Term Name="TERM_COMPLEX_GROUP">address</Term>
		</Property-->
	</Entity>
</Metadata>
